Activity ,Description,Link 
Hiking ,Explore nature and take in the scenic views on various hiking trails in the Bay Area. ,https://www.bayarea.com/play/best-hikes-bay-area/ 
Biking,Enjoy scenic routes on two wheels,https://bayareabikeshare.com/
Running,Join a running group or participate in a race,https://www.raceplace.com/san-francisco-running-events
Swimming,Cool off in a pool or take a dip in the ocean,https://www.yelp.com/search?find_desc=Swimming+Pools&find_loc=San+Francisco%2C+CA
Surfing,Catch some waves at popular surf spots,https://surfline.com/surf-reports-forecasts-cams/united-states/california/san-francisco/5351606
Yoga,Find inner peace through yoga classes,https://www.yogasource-sf.com/
Pilates,Build core strength with Pilates classes,https://www.bodyrokstudios.com/
Crossfit,Get fit with high-intensity workouts,https://crossfitsanfrancisco.com/
Dance,Learn a new dance style or show off your moves at a club,https://www.meetup.com/topics/dancing/us/ca/san_francisco/
Rock climbing,Scale indoor or outdoor walls,https://touchstoneclimbing.com/dogpatch-boulders/
Workouts,Description,Link
Yoga with Adriene ,Yoga classes for all levels,https://www.youtube.com/user/yogawithadriene
Fitness Blender,"Full-length workout videos for strength, cardio, and more",https://www.youtube.com/user/FitnessBlender
POPSUGAR Fitness,High-energy cardio and dance workouts,https://www.youtube.com/user/popsugartvfit
Blogilates, Pilates workouts for core strength and flexibility,https://www.youtube.com/user/blogilates
HASfit,Fitness and wellness workouts for all levels,https://www.youtube.com/user/KozakSportsPerform
Body Project,Full-body workouts for weight loss and toning,https://www.youtube.com/user/BodyProjectFitness
Jessica Smith TV,Low-impact workouts for all levels,https://www.youtube.com/user/jessicasmithtv
Fitness Marshall,"Dance workouts with fun, upbeat music",https://www.youtube.com/user/TheFitnessMarshall
Boho Beautiful,Yoga and Pilates classes with stunning scenery,https://www.youtube.com/user/cexercize
MadFit,Quick and effective workouts for busy schedules,https://www.youtube.com/channel/UCpQ34afVgk8cRQBjSJ1xuJQ
Recipes,Description,Link 
Avocado Toast with Egg,A simple and nutritious breakfast or snack,https://www.eatingwell.com/recipe/251138/avocado-toast-with-egg/
Greek Yogurt Chicken Salad,A protein-packed lunch or dinner option,https://www.delish.com/recipe/41130/greek-yogurt-chicken-salad-recipe/
Quinoa Salad with Roasted Vegetables,A colorful and flavorful side dish,https://www.cookinglight.com/recipes/quinoa-salad-roasted-vegetables
Cauliflower Fried Rice,A healthier alternative to traditional fried rice,https://www.eatingbirdfood.com/cauliflower-fried-rice/
Sweet Potato and Black Bean Tacos,A vegetarian meal that's easy and filling,https://www.ambitiouskitchen.com/sweet-potato-black-bean-tacos-with-avocado-lime-crema/
Baked Salmon with Herbs,A simple and flavorful way to cook salmon,https://www.foodnetwork.com/recipes/ina-garten/baked-salmon-with-herbs-recipe-1913117
Vegan Lentil Soup,A hearty and nutritious soup for colder weather,https://www.acouplecooks.com/vegan-lentil-soup/
Easy Roasted Vegetables,A versatile and healthy side dish for any meal,https://www.eatingbirdfood.com/easy-roasted-vegetables/
Chia Seed Pudding,A nutritious and easy-to-make breakfast or dessert:,https://minimalistbaker.com/how-to-make-chia-pudding/
Peanut Butter Banana Smoothie,A creamy and satisfying smoothie for a quick breakfast or snack,https://www.allrecipes.com/recipe/241028/peanut-butter-banana-smoothie/